[
  { "weaponId": "normal_01", "successRate": 0.9, "failRate": 0.1, "failResult": "fail_destroyed" },
  { "weaponId": "normal_02", "successRate": 0.85, "failRate": 0.15, "failResult": "fail_destroyed" },
  { "weaponId": "normal_03", "successRate": 0.8, "failRate": 0.2, "failResult": "fail_destroyed" },
  { "weaponId": "normal_04", "successRate": 0.72, "failRate": 0.28, "failResult": "fail_destroyed" },
  { "weaponId": "normal_05", "successRate": 0.65, "failRate": 0.35, "failResult": "fail_destroyed" },
  { "weaponId": "normal_06", "successRate": 0.58, "failRate": 0.42, "failResult": "fail_destroyed" },
  { "weaponId": "normal_07", "successRate": 0.5, "failRate": 0.5, "failResult": "fail_destroyed" },
  { "weaponId": "normal_08", "successRate": 0.42, "failRate": 0.58, "failResult": "fail_destroyed" },
  { "weaponId": "normal_09", "successRate": 0.35, "failRate": 0.65, "failResult": "fail_destroyed" },
  { "weaponId": "normal_10", "successRate": 0.28, "failRate": 0.72, "failResult": "fail_destroyed" },
  { "weaponId": "rare_01", "successRate": 0.45, "failRate": 0.55, "failResult": "fail_destroyed" },
  { "weaponId": "rare_02", "successRate": 0.4, "failRate": 0.6, "failResult": "fail_destroyed" },
  { "weaponId": "rare_03", "successRate": 0.35, "failRate": 0.65, "failResult": "fail_destroyed" },
  { "weaponId": "rare_04", "successRate": 0.3, "failRate": 0.7, "failResult": "fail_destroyed" },
  { "weaponId": "rare_05", "successRate": 0.25, "failRate": 0.75, "failResult": "fail_destroyed" },
  { "weaponId": "rare_06", "successRate": 0.2, "failRate": 0.8, "failResult": "fail_destroyed" },
  { "weaponId": "rare_07", "successRate": 0.16, "failRate": 0.84, "failResult": "fail_destroyed" },
  { "weaponId": "rare_08", "successRate": 0.12, "failRate": 0.88, "failResult": "fail_destroyed" },
  { "weaponId": "epic_01", "successRate": 0.28, "failRate": 0.72, "failResult": "fail_destroyed" },
  { "weaponId": "epic_02", "successRate": 0.22, "failRate": 0.78, "failResult": "fail_destroyed" },
  { "weaponId": "epic_03", "successRate": 0.17, "failRate": 0.83, "failResult": "fail_destroyed" },
  { "weaponId": "epic_04", "successRate": 0.12, "failRate": 0.88, "failResult": "fail_destroyed" },
  { "weaponId": "epic_05", "successRate": 0.08, "failRate": 0.92, "failResult": "fail_destroyed" },
  { "weaponId": "legendary_01", "successRate": 0.15, "failRate": 0.85, "failResult": "fail_destroyed" },
  { "weaponId": "legendary_02", "successRate": 0.1, "failRate": 0.9, "failResult": "fail_destroyed" },
  { "weaponId": "legendary_03", "successRate": 0.06, "failRate": 0.94, "failResult": "fail_destroyed" },
  { "weaponId": "legendary_04", "successRate": 0.03, "failRate": 0.97, "failResult": "fail_destroyed" }
]
